comment_id,comment_text,date
52ed85626b191db50547a24f784d7587,"Thanks for the analysis. While I agree no doubt that housing affordability is getting worse, it should be expected that non-mature estates grow faster than wage, because they become more mature. As the amenities come online, they become naturally more attractive. There will then be even newer estates (e.g. Tengah) that offer cheaper prices.",2022-10-08 14:41:09 UTC
24d4f6394a2323332637dc8127deb5ec,"The “cheapest prices” you cited - those are individual transactions? If so, they represent 4 single data points in a market of thousands of transactions. Surely that’s not useful for any kind of meaningful analysis",2022-10-08 16:02:12 UTC
5e8e0df74a0fabdb23560a66e3afded9,"The counterargument to what you have posted is that this is entirely the function of the system. Not so coincidentally in 2019, HDB expanded and increased grants across the board, especially for resale flat purchases. These grants disproportionately benefit the young, as their incomes are low enough to benefit most from the scheme, hence why many young couples are choosing to BTO once they are stable. The more well-off are more affected by these, given that they do not qualify for the various grants and have to bare the brunt of the price increases, which is good news for the rest of us.

https://www.moneyline.sg/4-new-housing-grant-for-first-time-homeowners-in-2019/",2022-10-08 14:50:54 UTC
b4fbc6e225019d2cd674d7ba5c5e4483,Time to be homeless,2022-10-09 00:23:13 UTC
bdab15f4f37c33435ede55288e762b4d,"Going with your wage data, those who are 25-34 make more money than those who are aged 55 and above, even after factoring in the change in wages over the 2 year period. Shouldn’t that, by your logic, make it easier for young people to buy homes?",2022-10-08 23:47:06 UTC
4081b2b6bc186fed45d6487d06e57784,360k over 30 year loan is doable for household income $7-8k. Also a hdb flat is an appreciating asset not an expense so this comparative is only one dimension. If you say chicken rice price rose 35% vs wages 3% then that's a serious concern.,2022-10-09 00:50:37 UTC
da45b4a48341f09db24e02dda811b478,how long did you spend monitoring this?,2022-10-08 18:18:08 UTC
edd7832777cbe2768ed259713da94015,"Comparing 19-22 is just stupid since we all know it's due to once in a lifetime extraordinary circumstances surrounding the housing shortage

The current housing issue is due to a combination of shortage in supply due to lack of workers during covid and sudden increase in demand due to sudden influx of foreigners due to reopening. It will be adjusted in time. It always has. If you think its not affordable now, just wait a bit

With the US messing with the world economy the adjustment is going to come faster than you think. Everyone is expecting a recession next year",2022-10-09 18:17:51 UTC
8452c7c0a35dfec5be28e4c97ac6e19b,TLDR,2022-10-08 14:35:49 UTC
2fb4c88295e378d2abc62f0c31b82c0a,"The last time someone did serious calculations, he got exiled. Mathematics is a dangerous subject people!",2022-10-08 17:22:00 UTC
8b927402e030f6d301bb734f30c23c5a,"The price of Singapore being an attractive global city in terms of security, safety and wealth preservation hub - low taxes, strong currency and pro business govt",2022-10-09 11:15:11 UTC
7133c166145b2392032038a192f633bf,"Oh yes a loss when selling cheaper to benefit citizens. 

The same I incur a loss when I feed my kid",2022-10-04 09:30:22 UTC
0855d28db9921184a326d55f1f141c9b,"Given that Hdb is a stat board and not for profit. Isn't it reasonable to expect it to make losses?

I would be more worried if hdb is making money lor LoL 😂",2022-10-04 11:56:32 UTC
20a61a06a6b6de38ecc0710c7c3b25bf,"Ok. Obviously BTOs are made cheaper than market resale units. Then we don't we do this, calculate how much the actual cost to develop each unit is. Then when the BTO owner sells the unit, make them pay back the difference with interest. I mean these are public funds right, why are we using public funds to fund the profit of some people? I don't understand how they can calculate the exact amount it is costing taxer payer money but continue to let people flip it like prata. If it some low income family making a profit, fine. But it usually those that don't exactly need government help that are profiting from it.",2022-10-04 10:07:40 UTC
5999951f8ae6afb51ba6a665beeb919f,"there's no ""land cost"" when you already control the goddamned land.

there is only opportunity cost, which when communicated this way, transparently shows you the government's desire to have all affordable housing eventually being relegated to the ulu areas in deference to the wealthier subpopulation and/or businesses who will pay more for the good parcels.

when HDB says they lost $270m building in AMK, it's like your mother reminding you how much you owe her for raising you when she could have been so much better off if she didn't get married and have to give birth to and raise your ungrateful ass so many years ago.",2022-10-04 17:24:09 UTC
423fe1c5704c83ba9bbe090a51035cc7,"Left pocket incur a loss because right pocket needed more money. 

Jokes aside. I think they are trying this say that land could have been sold to private developers for a much much higher price.",2022-10-04 09:35:55 UTC
4cab0150a70ce175902f5d2dbc51b4b9,I take out one dollar from my wallet and put into my pocket also considered loss from my wallet’s view,2022-10-04 13:06:00 UTC
0360ca9ef46a10709babf1843d06d2ff,"Fixating on the financial sheets of *one* agency and losing track of the greater issues at hand is appalling, to say the least.

If we look at what this deficit pays for, is it so bad if there is a deficit?

Firstly, this is *subsidised* public housing, and this is what the government has marketed HDB flats as! Deficits are *expected*, isn’t it? If you have a ballooning property market and high land price that outpaces households’ income, isn’t it *expected* for the deficit to grow? If not, it would in effect be a relative reduction in the subsidies given to the people, and thus making public housing less affordable over time.

So what is the government’s goal towards public housing? If it is about retaining affordability (as they claimed), then why harp on the deficit? If they want the financial sheets to look nicer, then they will have to subsidise less and hurt affordability, then they can’t claim they “care” about affordability. If they want both, then go and rein in the housing markets and stop monitoring.

Secondly, what is this land cost? It is said that HDB land costs are high because if state land were given to HDB cheaply, future governments would be less inclined to set aside land for public housing when they can sell it to private developers for funds.

Okay, while that makes some sense, where does the money go? It goes back to the government, *technically* not *this* government, but to *future* governments. Proceeds from land sales goes to the reserves, “national savings” that can be utilised in time of need (such as the covid budgets that helped weathered some economic impact of covid).

Thus, the present government has little incentive to preferentially sell land to private developers, since the present government (theoretically) cannot easily access the reserves anyway. And since the URA and HDB *falls under the same ministry*, which is the Ministry of National Development, why would the *same minister* sabotage his own portfolio for little gain?

Thirdly, even if land costs are high, so what? It helps to subsidise homebuyers and ensure affordability, which is a good thing to spend tax money on (collect more from richer people, spend more on poorer people, as they claimed when raising GST). Furthermore, it helps to build up the reserves, which is also a good thing (hey, the government drew on the reserves during covid, don’t come back and tell us contributing to the reserves is a bad thing now).

Indirectly, the deficit will have further downstream benefits. Lower BTO prices could translate to lower resale prices, since if BTO prices are even lower, the difference between resale and BTO prices will become bigger, which incentivises supply and thus create a downward pressure on resale prices. This also helps to mitigate the long wait needed to get a BTO flat, by making the alternative (resale) more accessible for time sensitive homebuyers, since they refuse to abandon the now inflexible BTO system (that was meant to be flexible).

Lower BTO prices would also lower the percentage of income spent on housing, giving people more disposable income to spend, which can also boost the economy slightly and make people a little bit happier. It could also allow people to have more savings, which is not a bad thing (importance of saving is a motivation behind the CPF system, so don’t tell me that’s not worth considering).

The deficit doesn’t totally disappear. Part of it goes into the reserves through the land costs, and more reserves would give our sovereign wealth funds more money to manage, and thus more investment returns. Some of the investment returns do go back to the Budget, as part of their contribution, while the rest continues to grow for the benefit of Singapore’s future.

If I were to stretch it further, cheaper BTO prices would even help birth rate, since so many people complained that *cost of living* is a negative factor on their choice to have kids.

Long story short, this argument from HDB is a *short-sighted and narrow one*. It fixates on a small part of the government’s goal (responsible spending), but failed to consider the greater and long-term picture (subsidies and wealth transfer, future resilience, social impact, etc.).

Not all deficits are *bad*. As with the argument for GST increases, taxes does not just fund the government’s operating expenses, they fund wealth transfers too. When you are doing wealth transfers, *you are expected to have some deficit, are you not?*",2022-10-04 11:14:21 UTC
2452562df6b3ad5a73db4631ae4d7ecb,"remember when Value Dollar had that ad ""you gain, we lose"" lol",2022-10-04 11:09:23 UTC
dce73c11f2e572df2e84a46972b65f46,Does mindef use similar methodology to determine how much they have stolen from us guys over the years?,2022-10-04 12:40:35 UTC
d7c782086bd72734067c881b059cd98a,"Singapore will incur millions in salary losses from paying ministers and ministerial staff with no job scopes nor sense of reality, says reality.",2022-10-04 21:16:39 UTC
801df53e3aae6b96de1314f0a3f234b5,"Not going to get into the debate of whether land cost should factor into cost of HDBs. However, is anyone else getting the feeling that someone is starting to worry about the unhappiness on the ground and trying to show he's not just monitoring and that MND/HDB already very poor thing, making so much losses and it's not their fault prices are so high.",2022-10-04 09:47:20 UTC
2ec63ad52f74aed3b4fe29031931fc0f,"I incur a loss every day. 

I place a valuation of $20000 a month on my time, but my employer only pays me $5000.

I incur a loss of $15000 every month.",2022-10-04 11:05:24 UTC
3c766aa7540a77f5b62456f7fb5532ae,"Change the minister for national development pls, ever since Desmond took over wah every measure has been reactionary and now he wanna complain/gain sympathy when HDB incurs losses to sell it cheaper for citizens",2022-10-04 12:27:07 UTC
4ca7f99ad35d10ef04e443ddb386241d,Boo hoo?,2022-10-04 09:33:55 UTC
aabd599215727f5d12fc6727c4e74f29,i think housing will be a very very hot topic for the next GE,2022-10-04 12:11:26 UTC
c26c0a1e04c4f17074103e8d6a3d6095,"remember when government “loss” was called government subsidy?

pepperidge farm remembers.",2022-10-04 14:43:19 UTC
cd53e2f4f7f2f55409da48b6713ef478,Please. Can don’t do this kind of Hollywood accounting and tell me the Govt is losing money building BTOs or not.,2022-10-04 13:35:14 UTC
d99c97cad7a93359285f1e301a4cd4d4,"This whole issue is merely a political policy. Land is state owned, why should market value be a determinant when using it to build state housing.",2022-10-04 09:50:28 UTC
7790de21cabe45dfded896997b898f5a,"&gt; The estimated land cost for the project was S$500 million

For some context, the land for Sky Habitat, a private condo in Bishan, was sold for [550 million](https://www.propertyguru.com.sg/property-management-news/2011/2/48539/bishan-street-14-site-attracts-s550-1m-top-bid) back in 2011. Sky Habitat is a smaller site compared to Central Weave, so the land rate(cost per sqft) for private condos is higher than that of HDBs, to account for the difference in restrictions over ownership.",2022-10-04 09:34:07 UTC
be0c2725e30cf2508c66d7fb145cf7f1,Basically taxpayers subsidise BTO buyers who profit when they sell their flats at market price + pegged to resale and private market. So all the resale buyers and private buyers go f themselves.,2022-10-04 11:31:49 UTC
ab09b281974fddb0ccf37dc5a2482d0e,"Next time, NSFs also must say same thing to their CO. Calculate how much they lose, based on the pay they would have gotten at 40yo, if only they reached it as same time as those foreigners from Malaysia/India/FPhillipines",2022-10-04 14:58:07 UTC
74f38ec9bfdd3144eeb4e83b4347cda4,"No use bitching, though I understand the sentiment.

Keep these statements in mind the next time you vote.",2022-10-04 13:44:56 UTC
9f5c347b00173d1421907e62e9b448ca,If they are truly open about it they should release data for all HDB projects.,2022-10-04 23:04:30 UTC
fa6e606826c70d774cfd6c5d64831b98,Ok and? The economic and social cost of homelessness is worse??,2022-10-04 14:38:04 UTC
ca87b8440e88ad7002f64240f092f623,"Land cost? Wdym land cost you own most of the damn land in the island, are they buying land from landed property owners to build the HDB? ELI5 I’m no property analyst.

This some left pocket right pocket shit.",2022-10-04 13:13:58 UTC
a03f3591b5cd5b0947e937068ed0d19f,Are we really capitalising opportunity cost now?,2022-10-04 12:42:56 UTC
5ce428e48aa08844b23a2b6381e7d0a0,"Desmond, today if u say u make a profit no one’s going to congratulate you also leh. Wtf u telling us u “incur” loss for? The money come out of your pocket?",2022-10-05 00:43:43 UTC
f334e0f0e3513be9a260b7a65214f40e,"Strongly disagree with the way govt calculates the cost to HDB. 

HDB is not ownership, you are officially the leasee. You can be SERS for no other reason than selling to private developers. You do not get the funds from the sale to private developers, only the govt does.

Govt does this, reduces size of flats, and wonders why people aren't getting married, aren't having kids.",2022-10-05 01:40:48 UTC
e0ab725c5740aa4989422e1c1d9d2c14,wait till they make losses at the polls. then see whether govt will complain about HDB losses. Fed up with Desmond Lee and how he talks.,2022-10-05 01:44:02 UTC
0a551b44a7ee1f3d8c6be6c7774be76a,"This is bloody irritating to read. For a 600k BTO unit, HDB construction cost is 200-300k. Its only making a loss because it paid to the Reserves 300-400k first.",2022-10-05 09:57:25 UTC
92b667ea617f81ccba1091b4ebc73f81,"Everytime I pcc I’m actually making a loss, as I could have set up an OF account and posted it to boost my subscription.",2022-10-04 14:43:29 UTC
8615c0fdffd0c236bcb944455ff87b3e,"so givig citizens housing is a bad thing ?

gotta import more foreigners ?

want to kcik singaporeans out ???",2022-10-04 14:51:35 UTC
c48ee0da7eef3e9fc36ad6b396dce9a8,"They just ""forgot"" to tell us that they make $billion/year from the land sales to HDB.

OTOH, they exclude these very same land sales profits from the government yearly budget which then results in lower surplus or even outright deficit. 

If they had included the land sales into our budget (which is done for almost all other countries), it would have been near impossible to justify the GST increase.

Inconvenient truth.",2022-10-04 09:41:00 UTC
efeddaff533dc2b51371163d2c7574e5,"Ok I may be a bit of an idiot when it comes to this but why should the Government have to pay market rates for land acquisition (and by this i mean non-residential land)? I mean they could argue that its for the ""greater good"" as they don't need to raise taxes to make up the deficit due to public housing",2022-10-04 10:27:11 UTC
74fc2afa27feced5504c566206d12501,The market price of land is relevant because it reflects the opportunity cost to govt of building a HDB instead of selling that land to a private developer.,2022-10-04 14:24:12 UTC
022a2b2124cb45352493ac498a9fc1bc,"Gahmen: See? Since we loose money, housing is still affordable! You complain too much",2022-10-04 11:13:40 UTC
521e9783544f56464d2f6273d663074b,What’s the purpose of this article? Not sure how to feel. Am I supposed to pity them or what?,2022-10-04 10:41:34 UTC
b26417dc7117e1e9ab90d16edb909dae,BREAKING NEWS a government is working exactly as expected: by incurring short tert 'financial losses' that generate greater returns in the future.,2022-10-04 11:18:53 UTC
e6540f01eb6aa8c2160b553c9beaf4e4,"Not going to argue the mathematical validity, but this announcement move just stinks of bad PR attempt. So what if  HDB incurs losses?",2022-10-04 09:54:20 UTC
91178bc8bab485586d7e73af23579bae,Singer how this loss compared to other projects. If they give more subsidies to this bto,2022-10-04 11:09:45 UTC
271035e3ee3470eee741c761305167c3,"what about other BTOs ? make just as much losses ? So poor thing, everything they do also lose.",2022-10-04 11:28:22 UTC
5a7bcffc82f8a428f5c3f3df3c17ddfb,"Why shouldn't land costs be included? 80% of our population live in HDB flats, that's a lot of land taken for public housing, you just have to look at countries and cities which doesn't manage their land/land revenue properly. Land revenue in Singapore goes directly to the reserves, which benefits current and future generations of Singaporeans. 

The loss mentioned comes from the current budget, this is a prudent measure that ensures the current government does not imprudently make decisions that will cause harm to future governments. Even every single government building has to account for land costs that go into the reserves.",2022-10-05 02:03:37 UTC
702d633c9f08915827a9ef6ae7123a7f,"In the end all property confirm appreciate one, it’s just whether appreciate slow or fast. You can just look at China’s property market to see what happens when the people lose faith in property as a store of value. It’s unrealistic to expect prices to drop to what it was 10-15 years ago. Now the problem on the govt’s side is how can they slowly moderate the increase so that it remains affordable to most Singaporeans. Another way to look at it is that wages have been stagnant for too long and it’s time for our wages to start increasing to keep pace with inflation.",2022-10-04 11:17:55 UTC
97b9613d9112cc7ae540debe109624d7,Creative accounting pocket to pocket,2022-10-04 15:30:39 UTC
3abbea4158f7998c6fdd7dd9bb5d2621,So many of you are so quick to judge. The money is going into the reserve not to their pockets. It is very dangerous for a small country like to Singapore to have a low cash reserve in times of crisis. We have no resources except for cash.,2022-10-04 09:55:10 UTC
387dfe6dc062e5822adee909b583291b,"Technically since bto is 99 year lease means they inflated value 99 years later would definitely be more than 270 million, maybe few billions at this point. I.e they should see it as a win! /s",2022-10-04 10:33:42 UTC
a3250b0307c69f97bc679e91c02a3be5,Losses my foot...they better wake up their idea,2022-10-04 22:27:07 UTC
9a885737a9244ade680e9c0e0fadb6b2,"The bigger problem is that people that don't really need to BTO are now even more incentivized to BTO just because of every other day they are reminded how much money they can make after 5 years if they BTO. IMO, if the government want to control the price then control the prices of both the resale and BTO. Its okay if they want people to profit, but at least cap the profit or something. Don't let one go out of control and pretend it won't affect the demand of the other.",2022-09-23 16:56:07 UTC
ea47fc6530a11bf13fb245473f71aef1,Desmond encapsulating the quiet-quitting trend by simply doing the bare minimum to collect his salary.,2022-09-23 18:18:00 UTC
31f7d68f1f599b92f594e9abd9148e95,[deleted],2022-09-23 14:52:53 UTC
4e03d58500734616db4529871702e4f3,"If HDB truly wants to fulfil its public housing function, then cap the amount of profits people can make from it at the price they bought the flat at multiplied by the accrued interest of the flat. Anything more than that will be clawed back by the government when they sell the flat. 

Make it just a place for staying, not to make your first pot of gold. Disincentivize all those disgusting flippers. At least people who truly need a house to stay will finally get a chance to get a flat.",2022-09-24 01:26:22 UTC
64656196a6cfdb7f2b414652d04c3238,"Between affordable housing for all and large windfall gains for some, we choose the latter. Public housing need not be tied to insane capital gains. Priority in housing for families need not be tied to capital gains. These are policy choices.

HDB being a means of wealth transfer is not so bad in itself if it was only from the well off to the less so. But that's not the case. Our model is now such that BTOs in good areas are so expensive because of their flipping potential that you have to earn a pretty good income to afford them. Good job facilitating wealth transfer to these people. As a single, you could be subsidising your boss condo upgrade because he got married early.",2022-09-23 16:39:56 UTC
a1269288682e31ea4781f7a010138125,Fucked up situation. Thanks HDB,2022-09-23 15:26:21 UTC
7e4029a779ae84c5940568a8f6fae753,"Again, the monitor lizard continue monitoring",2022-09-23 22:33:32 UTC
e56bca6564c6455e42acd0ecc8c291b3,I checked out the price of my childhood HDB flat - they're trying to sell it for a million bucks...,2022-09-23 23:25:53 UTC
a2cc809cfa7edb9fc5bdd37518d46c6f,"It's retarded how public housing is being treated like private estates. Public housing is technically public property, just that we are buying leases to live in it. How is it that people are allowed to profit from it? I still don't get how HDB could drift so far away from its core mission. This is a major reason why I've lost faith in the Singapore system and government.

This article is basically admitting that this is a major problem, since resale prices can affect BTO prices, and it isn't simply a matter of the costs to construct the building. It is a problem that's been spiraling out of control for decades and the government is doing nothing about it.

Edit: Fixed spelling errors",2022-09-24 00:11:46 UTC
41ccaea840b696029adb2a986cb3bd14,"Why tf can't HDB regulate the market, what, they scared lose votes from rich property buyers ?",2022-09-23 15:53:33 UTC
2a4432c008425e7c8cd717a68557c229,"In the first place the promise that your 99-year lease house(that technically does not belong to you and can be claimed back if required) will appreciate endlessly is just stupid. This is something that really needs to change.

A BTO in a non-mature estate after 5-10 years would grow in value as more facilities are being developed makes sense and is realistic. Now a BTO in a mature estate that  is expected to continue growing after 20-30 years in value is just???

Also you would expect with mortgage rates (assuming bank rates here) being double that of past 2 years our housing prices would plateau or even drop a little but for some reason we are achieving new highs??",2022-09-24 05:20:22 UTC
573bc307309da40a6df3ba87ca32c51d,Hdb is the best market maker in the whole world. Better than those market maker in stock market. 🚀🚀🚀,2022-09-23 15:31:02 UTC
27c6fb0c8d4b075207ba8333735231fc,Monitoring?,2022-09-23 15:06:03 UTC
c43a90c2e3a9509470dce26b53b2d315,"Said it many times over already. Resale back to HDB, HDB then resells it at controlled price.",2022-09-24 02:57:46 UTC
1d6e425175fb9eb851dac8cd4231241f,"Rising cost...

Land cost is part of this cost yah? Govt can never lose lah.. Simi also they say one.",2022-09-24 06:07:17 UTC
699c9767fcd2d63ae6b41aece5a85cbb,All good for those on the gravy train,2022-09-24 09:54:39 UTC
9dffee061ed58c6185c699344d5d5fad,"Socialise costs, privatise profits. Same old same old.",2022-09-24 10:22:04 UTC
ed791cff24c3c78a81d524ee0d8ff9d7,They only cater to the rich in sg. The poor can go eat shit.,2022-09-25 01:32:43 UTC
c8d732569c842681d85a7a155960e337,"HDB is trying to do two things that are diametrically opposed: 1) get people into their own homes by offering them subsidized prices, 2) make sure homes go up in value each year.

A smarter way would be allow people to keep the value increase *only for the portion that they paid for*.

So if someone buys HDB for $400,000, but comparable resales are worth $600,000, then when they sell 10 years later for $800,000, they only keep 2/3 the gain because the other 1/3 was paid for by HDB.

So instead of making $400,000 on the sale, they'd get $267,000 ($800,000-$400,000*66.7%) and HDB ""claws back"" the other $133,000.   This is kind of what they are doing with Prime Locations now.

It's not a perfect solution, but at least it doesn't create a lottery effect where simply getting selected for BTO is like winning a sweepstakes of guaranteed government subsidy.",2022-09-24 06:13:27 UTC
e1035ddb548a62976c72ed856846b03d,"Lol when the gov is more interested in making the future land values higher n higher instead of lowering land costs to encourage family formation by having bigger n cheaper flats, u know they’ve given up on increasing the birth rate n it’s all about $$$.",2022-09-24 05:09:03 UTC
69840dd15d0c49a3fd6b000c7a1dc369,"In other news, water is wet",2022-09-23 16:57:18 UTC
