comment_id,comment_text,date
7afad2d458b2ca3e7a49e7848d8d9270,"History is repeating itself, but this time, only in a more ridiculous way. The housing shortage in 2010-2011 created a spike in housing prices which over a few years  gave way to price correction as the housing supply situation corrected as the Govt rolled out housing in response. Fast forward 12 years the same thing is happening again, only more severe because this time hdb prices are 25-50% higher than the 2010 peak and resale hdb leases in 2023 are now 10 years shorter than they were a decade ago. Hdb resale prices are therefore pie in the sky now and will certainly face a major correction in the years ahead as the supply situation corrects itself and as the remaining lease periods continue to shorten.",2023-04-17 12:21:59 UTC
3693a077fc7fcf0aa49e5628a19df9ad,"BTO remains a lottery; still over subscribed, supply lagging behind demand, insane construction times etc. In my humble opinion, BTO will not be a significant factor in cooling the ever rising housing prices within the next 5 years.

If you can afford it, and need a roof over your head fast, even if the resale is not as good a deal as say 1 year ago, my advice is to bite the bullet, because urgent housing needs trumps whatever savings you might get from waiting. This is coming from someone who bit the bullet begrudgingly last year. No regrets on hindsight.

Of course, if you can afford to wait, then wait. The housing bubble will burst eventually. No one knows when, but we know it will happen.. eventually.",2023-04-17 09:16:08 UTC
66a3dd0bfe0c418fa7b58e0407b4a396,"I think the current housing situation is quite different from how it is described in the article.

Reality:

\- Resale flat prices have increased for over 30 continuous months. Article says it's cooling but prices are still increasing, just at a slower rate. The previous time someone claimed prices were cooling was in Nov 2022. See ST article published then: [Public and private housing markets show early signs of moderation: Desmond Lee](https://www.straitstimes.com/business/public-and-private-housing-markets-moderated-after-sept-30-cooling-measures-desmond-lee). Been like 5 months of early signs of cooling now? 

\- BTO flat supply remains insufficient to meet demand. There was a severe oversubscription of BTO flats in 2022 with 23k units launched. Should have been obvious to everyone that there is an undersupply. But govt announced that they are going to maintain 23k flats to be launched in 2023. The 100k figure might make it sound like the govt is reacting to the demand. But this figure was [first announced in 2021](https://www.straitstimes.com/singapore/housing/up-to-23000-bto-flats-to-be-launched-a-year-over-the-next-two-years). So the govt hasn't adjusted the numbers up in response.

\- Wait time for BTO flats can be over 5 to 7 years (Time to win BTO lottery + long construction time)

\- Govt shows no urgency in prioritising BTO flats for those who need it more urgently. The measure they announced in Feb 2023 to prioritise married couples and give them an additional ballot doesn't even go into effect for the May 2023 BTO.",2023-04-17 08:07:34 UTC
fe22ae6d21b15ffa17e8ad0f0ca9bcaf,"Yes, if you are able to wait then now then you can get a lower price for resale HDBs. The situation now is pretty similar to 2012-early 2019 where rising global interest rates led to a decrease in property prices worldwide. Resale HDBs going up in price is actually a very recent thing that should end now that covid-era near-zero interest rates are over.

Opposition media [wrote many articles](https://theindependent.sg/dropping-hdb-resale-flat-prices-contradicts-lee-kuan-yews-promise-that-the-value-of-homes-will-never-go-down/) complaining about **dropping** resale HDB prices and how it [broke the promise](https://kenjeyaretnam.com/2018/08/23/pm-lee-the-value-of-these-homes-will-never-go-down-oops-i-lied/) that HDBs would be a financial asset for retirement. You can expect the cycle to repeat again.",2023-04-17 08:02:53 UTC
1f281b94fcf0a18d9fa1abeedae0090d,"If anyone can answer you this accurately they would be multi millionaires, not typing here on reddit.

Truth is people should stop seeing housing as some sort of get rich quick scheme!

If you need a house, get one. Find one that is within your means. But your time and happiness cannot be replaced. You can always make money elsewhere

Having gotten a resale myself, i can attest that the happiness gained from a place of our own is far more than what monetary gain would have provided.",2023-04-17 10:41:46 UTC
444ecdd734673f0283fd8c9be034d5a2,"Based on the property you are currently renting, waiting could cost you more. Those with unreasonable price (+COV) might drop but base price or evaluation price won't drop due to multiple factors.  


If your rent is 4k for (4RM HDB), one year waiting will cost you \~50k. Current 500k flat won't be 450k in a year. Even if it is after 12 months, you did not save any money.

If your rent is 2k for (3RM HDB/2 common room rental), one year waiting is around 25k. Cheap 3RM resale HDB with 50 years lease are around 300k, they won't be 275k in next year.",2023-04-17 09:17:31 UTC
176d723d1c331f8f6fa75f85bbc3d8fd,"It will take a drastic situation like war, recession or major policy change for the housing prices to take a big dip. Otherwise it is likely just price correction.",2023-04-17 13:09:20 UTC
100a9273318100ece50b3169226c1a3f,"If u need a house to stay, just bite the bullet and buy.

Regardless of any meaningful analysis, the market can stay irrational longer den u stay sane.",2023-04-17 13:22:28 UTC
adf64f8376e15f2fa169661f6873cb62,"My fiancée and I recently decided to purchase a resale flat, as we’re both in our thirties and didn’t want to wait ages for a BTO. We are also intending to live in this place long-term, so we took the time to find a place that we’d be happy settling down in. 

Yes, it sucks that it cost us quite a bit more than if we were to have bought 1 – 2 years ago. Yes, we had to compromise on a few things. But in the end we found a place we’re able to afford that also meets nearly all our requirements. 

I’m no property guru (hah), and so all I could’ve done was speculate. Either way, time together took precedence for us, so we did what research we could and took the plunge. 

At the end of the day, your considerations may be different from ours. For us, the best time to have bought was yesterday, but the next best time is today.",2023-04-17 13:31:12 UTC
1f1004d5d32674a76caf2843ff458f0f,"Just when you think it’s the dip, the dippity dip dip shows up and fuck you over before you even get your bto keys. Scared don’t buy, buy no scared. Houses are for living not speculating and I hope you won’t mind living with your favourite person earlier rather than later?",2023-04-17 10:45:24 UTC
d34d928ffac67e5600a7ebe0891f825f,"No one is able to predict housing price fluctuations at a 100% accuracy.

If you think prices are unsustainable (rents are, prices not that much IMO), then wait if you can.

If you can't wait, you'll just have to bite the bullet and buy the best deal you can source.",2023-04-17 08:53:47 UTC
18224332d30e5b75153fee314f6e9cfe,"Wouldn't bet on it. I'd just treat any potential ""losses"" from falling prices as ""rental"" from having a place to stay while waiting for prices to fall.",2023-04-17 09:37:00 UTC
0f87edb9791be37854dadded8e3e26e8,No. There may have be dips but its still an upward trend. There will always be people less patient than you and start buying again before it reaches the low point you will be comfortable with.,2023-04-17 10:19:24 UTC
55a8310114b4473d6ce51aeff4413e41,"even if u win a ballot number, and if the stars align, get a number low enough to choose floor and facing, u still need to wait ~5 years before u collect keys..

then theres defects repair, reno works etc so easily 5.5years before u move in.. and then another 5/10years mop.. if you factor in rental costs, resale and bto arent that far off ba

are you prepared to wait that long? if no, buy resale or private.. if yes, try your luck lor",2023-04-17 10:49:23 UTC
d9a8e31494362a33f364eb4c2e00ebc6,"Personal story from a well to do friend.

He stays with his parents in their condo, before the start of covid he was planning to buy another unit in the same place. In his mind, he wanted to be close to his parents in the same building he grew up in, there were units available but they were in the 7-800k. Around that period the government announced another round of cooling measures and he thought he could wait it out for the price to drop so that it won't hurt so much to get his dream home.

Covid and inflation happened, the rest is history. Now, he doesn't plan to buy another unit anymore because he can't afford to downpay it at all. While the unit he wanted is gone, price of similar the units in the condo is now a good 1.5mil+

His morale of the story, if you really want something, don't wait and just buy. To him it is better to have his want met even if he lost money, because now he just laments and regrets the missed opportunity.",2023-04-17 11:47:34 UTC
f8c7eaa33c569b16eebfc33a55910af9,BRB I get my crystal ball to check.,2023-04-17 08:01:50 UTC
ba7b27a499dc7e5282f49de31a4321ed,"the best time to invest is always now, time in the market beats timing the market, we could easily see another QE driven house price increase as seen after 2008, or see stagnating prices due to elevated interest rates post 2013

Nobody knows",2023-04-17 09:42:34 UTC
d88c6a970f21b7f64fc2880e9de24ce2,Buy when others fear.,2023-04-17 12:33:56 UTC
5650f041f46d928102ea1cc1a0bc5926,Offer my tip. Have rich parents who can pay for your condo/resale deposit.,2023-04-10 03:39:56 UTC
4b29112ef67abdffb3f1d71faed0a680,Did all of them. Didn't work. I want a refund.,2023-04-10 09:10:33 UTC
596aa09c4188165c64133e2a87fe7e34,damn the PUBLIC hosuing situation is so bad that we need application tips,2023-04-10 11:34:24 UTC
eebcd6dcfafebf0284fe4b1f5af8320f,"Applying for 3 room instead of 4/5 room makes no sense to couples who want to have more space for children. Now, I'm not saying you can't raise a family in a 3rm. Many families do, my SO family is one of them. But given that society attitude towards having more private space, wanting to shift towards wfh (topic for another discussion)... It's becoming less conducive to raise more than one kid in a 3rm, imo.",2023-04-10 05:10:24 UTC
e93f5e5b26c4a1b87e451a8b62dbe205,"Who would want to waste the priority on a location that does not appreciate?  The article also did not mention that the location of the next BTO is much better than this BTO.

Until this “asset enhancement” idea is scrapped, nothing will change.  Who wouldn’t want to win a TOTO 2nd prize via BTO lottery?  This is a sure win leverage, provided you get a good queue number 😂",2023-04-10 05:38:37 UTC
305e45d4560ec2dac66cc068244ae854,"Fix the lottery bto policies and the application numbers will follow suit. Imo, some are applying just to flip. Those wanna flip, please get your own condo. Hdb is public housing!!",2023-04-10 14:37:53 UTC
dbeff9bd02da851875627828981f090a,"The first 3 points are basically ""Apply for not so great options that other people don't want"".",2023-04-10 12:46:23 UTC
a1253e626211897bb18b2362caebde8c,I know couple with child balloted for multiple years and couldn't get a number in range.,2023-04-10 12:43:19 UTC
2f65cd7df77dd269f3eda01b4983246b,1. Vote our the PAP who turned public housing into another form of private housing that wipes out your retirement and leaves you with kosong after the 99 year lease is up.,2023-04-10 16:39:44 UTC
61bd3f7ff6964d362f60d8b5beeb1861,Bunch of solid advice. Pity no one will actually take it.,2023-04-10 04:36:43 UTC
b9137b0000859a97252206c85c152c96,Typical. Zero effort statement.,2023-04-10 00:13:50 UTC
0566319b98f3ad90160ae4ce62fb7a9e,Pattern more than badminton when it comes to excuses…,2023-04-09 21:12:27 UTC
340dbb0fd217fa16fbb2181970e0c491,Cannot swim just say cannot swim.  don't say swimming trunks too big..,2023-04-10 04:51:58 UTC
35a21fed19523f5ff8df6767f92999b1,Correct it’s just hoping that no one cares and “Just Move On”,2023-04-10 00:29:33 UTC
566c33a737c6dc6c00f786e55e7f92e7,Basically it's an honest mistake let's move on,2023-04-11 02:42:38 UTC
709fe6128f204ce903967fb390fd41db,No blame culture let’s move on,2023-04-11 16:37:03 UTC
6d00823999af51182052d57d9b337317,ownself praise ownself.🤦🏻‍♂️,2023-03-06 14:05:32 UTC
a59681e9458bd967c25cc3f10ff3640d,Or people are just waiting for better locations.,2023-03-06 11:59:45 UTC
aa6be8af7707f5f2aa866d62c2d30a28,Or people just postphoned buying and will continue to rent or buy resale.,2023-03-06 09:51:52 UTC
0fe993ad38634d1d71942c0a570200e2,Typical “pat ourselves on the back” bullshit,2023-03-06 09:42:50 UTC
bf792e5a53b71a7ccab62c7dda66551f,"Tell people that they can only collect keys in 2030 when the pregnancies are all considered high risk as the mothers are all over 30YO.

Result: Young couples get discouraged and are forced to drop out of the BTO queue.  Throw away their retirement adequacy by buying overpriced, high depreciation resale flats paying high mortgage payments for nothing back when flat is 99YO.

Immediacy pats ownself in the back, trumpet “Job well done” in the owned press and claim “Mission Accomplished”.

Next year raise salary for the Monitor Lee-zard!!!",2023-03-06 10:05:44 UTC
6f88308c563100068ec628a06da7c2db,That’s just one way of framing. Another way to picture this is that couples have given up applying for bto after several failed attempts and turned to private or rental. It really depends on how you frame things.,2023-03-06 23:18:56 UTC
0d8110080e1e9a5bb105d010b917df2c,"My goodness, the rental market is just gonna explode 🤯",2023-03-06 11:49:20 UTC
558c8a1da337bbfc9be5677c5b8111fc,"- Meh location
- Bad layout (literally all 5 are the same, why can't they align the living room w bedroom like for some bto or work with dumbell layout to better use the walkway space) 
- Still the same waiting time where the recent news say they aim to ramp up construction time. (Why bto now when in future the later btos have shorter wait time)
- There's still the whole prime location thing (Dover doesn't feel like a good prime location)",2023-03-06 15:23:25 UTC
e9422a26bdca159d17c2cfc549b5294c,"I hope the government does not see the stabilizing application rates as a reason to reduce supply ~~the 25,000 HDB flats they plan to release~~ next year.

Edit: couldn’t find the 25,000 value next year specifically.",2023-03-06 10:40:04 UTC
3d19c69c4807fc9bdfd330e16148ee8e,"You get a BTO, He get a BTO, Everyone get a BTO!!",2023-03-06 10:17:05 UTC
f437956aff9ebcde2d5664ebfaff8344,How about allowing the growing number of singles to join in? This will surely motivate the government to build more,2023-03-06 14:35:08 UTC
5471308cfcd622aaf72fec2c60588385,"&gt; # February BTO launch has lowest number of first-timer applicants since 2020; application rates stabilising: HDB

&gt; SINGAPORE - Fewer first-timer homeseekers applied for the February Build-To-Order (BTO) sales exercise compared with launches in the last three years - an early indication that application rates have reduced and are stabilising, said the Housing Board.

&gt; The number of such applicants was the lowest since the February 2020 launch, at around half of that in some of the past 11 BTO launches, HDB added in a statement on Monday.

&gt; As at 11am on Monday, 12,493 applicants applied for 3-room and bigger flats, of whom 7,513 were first-timers. This is compared with the 20,252 applicants in February 2020 sales exercise, of whom 14,145 were first-timers.

&gt; A total of 4,428 BTO projects across five BTO projects in Queenstown, Kallang/Whampoa, Jurong West and Tengah are up for sale in the current exercise.

&gt; First-timer applicants who applied for BTO flats in the Ulu Pandan Glades BTO project in the mature estate of Queenstown, the Jurong West Crystal BTO project and Brickland Weave BTO project in Tengah, will have a good chance of securing a flat, said HDB.

&gt; This is because the first-timer application rates across all flat types sit between 0.2 and 1.8, meaning fewer than two applicants are vying for each flat.

&gt; Considering the average rejection rate of 40 per cent seen in previous BTO launches, most applicants will be able to select a flat if the application rate of a project is below 1.7.

&gt; In this launch, the median application rate for first-timer applicants for three-room and bigger flats stands at 1.8, which means almost all will be likely to book a flat.

&gt; Barring a last-minute surge in applications, first-timers applicants gunning for a three-room flat in Ulu Pandan Glades BTO project are all but guaranteed a unit, as it remains the only one that is undersubscribed.

&gt; But those going for four-room flats in two Kallang/Whampoa BTO projects will face tougher competition, with around three applicants for each available flat.

&gt; The Farrer Park Fields BTO project in the mature estate falls under the prime location public housing (PLH) model, which comes with stricter buying and selling conditions, while the Rajah Summit BTO project does not.

&gt; At this stage, applicants can only apply to one flat type in one town. They will only be able to select whether they want a flat in either Farrer Park Fields or Rajah Summit at a later stage.

&gt; Applications will close at 11.59pm on Monday on the HDB flat portal.

---
1.0.2 | [Source code](https://github.com/redditporean/sneakpeek) | [Contribute](https://github.com/redditporean/sneakpeek)",2023-03-06 09:39:09 UTC
06ed8bd9d71ea89ddbbffaa0d38375e5,"It's low only for first time applicants.

That's because 2021 and 2022 first time applicants were high, but they didn't necessarily get, and became second timers. During that COVID period prices were damn bloody high (And still are now) and cannot view house to but from open market etc, so people just applied BTO.

So 2023 Feb the amount merely reverted to pre-covid figures, how is this successful? You mean we measure success by doing enough and not improving?

The real stat we need is how many first time applicants became second, third, etc timers, but have not ever purchased a HDB, and how many of them were offered but didn't take.

Everytime they release some data, is some standing ovation nonsense, but the full picture not clear at all.",2023-03-06 12:46:42 UTC
266635b37f0abaea60818255a5ec71f0,"Is this the classic ""ownself check ownself?""

As I wrote in another thread about this, it doesn't take a rocket scientist to figure out why the application rates aren't sky high:

2 projects in ulu locations - lets face it, most singaporeans are still against staying in the far west, no matter how affordable, unless they are alrdy westies or northies.

2 projects under PLH, smaller than normal flats and massively inflated prices (BTO 4 rm max price for Pandan gardens is 711k), one of them has a waiting time of SIXTY EIGHT months, which is almost six years. 

I don't need to be a minister to draw these conclusions. 

The knock on effect - rental market goes crazy, NEXT round of BTO will be the true test.",2023-03-08 02:07:29 UTC
e6294924f349589e644165b3f6921138,"Lowest first timer means high number of multi-timers, people who were not able get BTO after multiple times.

Am I right?

And that's a good thing?

Shouldn't it be high number of first timers be a good thing because it means HDB is able to clear all the multi-timers?",2023-03-06 16:57:44 UTC
e2824ce5a0246754bbdb81330ffe3839,Have a look at the population distribution by age,2023-03-07 00:39:31 UTC
bb4e9e20b003877e132e5f37a3f13367,The season starts now vibes,2023-03-07 02:18:37 UTC
20bdd6043f769dc53a226d3f60d63a6f,"As if prices aren't too high, locations suck, and bto quality sucks

Hdb and mnd y'all fucking stupid or what?",2023-03-08 00:06:20 UTC
b653037d589833d05f3e2c35f1d7b57e,HDB should wait till May's launch before patting themselves on the back. May 2023's launch has a lot of attractive projects.,2023-03-06 10:10:15 UTC
3f3eff614d4681567901085a828c6f29,"Fucking idiots really. Too many people want a BTO? Lets make BTO unattractive, problem solved.",2023-03-06 09:06:42 UTC
ee353c17f8dda130d4a5cba2937ff254,When u monitor until the problem “solves itself” (more like the people give up liao). Now to see whether they will pat themselves in the back for doing a good job…,2023-03-06 09:01:36 UTC
50dc1167cf075884829ef40d86038939,Because…I could pay slightly more to get a resale now instead of waiting 5 years later and by then we can’t have kids anymore?,2023-03-06 10:02:00 UTC
9287014fd1f59402c269b99f5accc8c1,Someone want to make the population angry before the next election err?,2023-03-06 13:25:47 UTC
1097979fba8a168bb2555ba93e1555ee,"Reduction of BTO application rate is an achievement for them???

This government is damn messed up",2023-03-06 23:16:43 UTC
211dc564a6a7d0da36b11c6e60c8d135,"Tell people that they can only collect keys in 2030 when the pregnancies are all considered high risk as the mothers are all over 30YO.

Result: Young couples get discouraged and are forced to drop out of the BTO queue.  Throw away their retirement adequacy by buying overpriced, high depreciation resale flats paying high mortgage payments for nothing back when flat is 99YO.

Immediacy pats ownself in the back, trumpet “Job well done” in the owned press and claim “Mission Accomplished”.

Next year raise salary for the Monitor Lee-zard!!!",2023-03-06 09:53:22 UTC
d274cef415a50bfdfee90e1814149d35,30k grant extra for resale is pretty tempting for immediate housing.,2023-03-06 11:10:28 UTC
bb85f386705ad683dc054363b646f40f,Maybe because many people are staying single now so less couples to apply for HDB?,2023-03-06 08:24:31 UTC
32f993dc2872c1ac036a6f0246144e1f,"&gt; # Early signs that BTO application rates have reduced and are stabilising: HDB

&gt; SINGAPORE: There are early indications that application rates for Build-to-Order (BTO) flats have ""reduced and are stabilising"", said the Housing and Development Board (HDB) on Monday (Mar 6), hours before the February sales exercise closes at the end of the day.

&gt; More than 4,400 new flats were launched for sale this round, spread across five projects in Kallang Whampoa, Queenstown, Jurong West and Tengah.

&gt; ""The February 2023 sales launch also saw the lowest overall number of flat applicants, particularly first-timer applicants since the February 2020 BTO sales launch, with this number hovering around half of the number of flat applicants in some of the past 11 BTO sales launches,"" HDB said, referring to figures as of 11am on Monday.

&gt; For instance, a total of 12,493 applicants applied for three-room and bigger flats, of whom 7,513 were first-timers. In comparison, there were 20,252 applicants in February 2020, of whom 14,145 were first-timers, it added,

&gt; The median application rates for first-timer applicants for three-room and bigger flats is 1.8, said HDB. This is close to the application rate for the November 2022 BTO sales exercise, which had double the flat supply of this launch.

&gt; The median application rates of 1.8 at the November 2022 launch and 2.0 at the February 2021 launch are the lowest in HDB’s quarterly sales launches in the past three years, said the agency.

&gt; First-timer applicants have a better chance of securing a flat as they get two ballot chances instead of one, and up to 95 per cent of the flat supply is reserved for them.

---
1.0.2 | [Source code](https://github.com/redditporean/sneakpeek) | [Contribute](https://github.com/redditporean/sneakpeek)",2023-03-06 08:22:31 UTC
0b82143932e8c28fcb989aea6183826c,Correlation does not mean causation? Causation does not mean correlation? Orrrrrr this shit tells us nothing.,2023-03-06 10:25:13 UTC
52c26f8fd9a97e9f3159d428c021bd0f,"Preorder Alpha, Beta “steam discount”",2023-03-06 09:06:23 UTC
e823d795355a27b840b650efccdc4c15,..And other lies we tell ourselves,2023-03-06 15:17:31 UTC
b99a053c1198fae5936bb561305f2c12,At least it puts off insincere buyers.,2023-03-06 14:57:09 UTC
6a905b66161e42c16c9d8117032cff62,"5.1mil over 900 BTO = 5,666 on average.

For breakdown comparison.",2023-03-04 12:09:08 UTC
95508d1d2023b45d7db9526c6d62ae44,"As mentioned in the article, each unit will get an average of $5750 for a year of delay, that is kinda derisory no? I rather get my house on time than to get this paltry amount. It is not even enough to rent a small HDB room for a year

Launched in 2017, it will have been 6 years since. I feel sorry for people who bought the units",2023-03-04 12:32:30 UTC
317ea5a5dd894eace910f86ad50575fb,"Market price for land, but compensation isn’t market price for rental.",2023-03-05 01:15:05 UTC
cb2330ced34253831f33875921d2b0a7,LOL fuck this stupid hdb. 5k for 1 year of people's time of having to redo plans. Holy fucking shit. Thats the worst compensation ever. And they wonder why no babies. Just who the hell is making all these policies??,2023-03-04 14:32:02 UTC
45e732ca0ab50c7e0e2584a9d89484ea,Bet some redditors saw “$5.1m” and “HDB” and got PTSD.,2023-03-04 13:24:17 UTC
af0eff70d911584013dc11f907859857,"Paltry compensation. 

And the ""new"" flats are most probably in a shitty state too due to the delay &amp; the likely rush job the new contractor had to undertake.

Thanks HDB for inspiring confidence as usual.",2023-03-04 16:36:13 UTC
78dd8e3165c8073b97e5fe857bc963f5,"So one person around $5k only?

Delay 1-2 years? Where got enough to pay for rent?",2023-03-05 05:01:03 UTC
c91b015699778e48466a9ca6c7c7b769,"The financial cost for these homeowners far outweigh the compensation. With inflation, time lost and delays on family plans. Seems like HDB thinks it’s only worth 5-6k avg.",2023-03-04 23:51:53 UTC
