comment_id,comment_text,date
f1d98c269c801157e299939c2ddefd78,"&gt; # Two-thirds of BTO projects completed during Covid-19 outbreak delayed by 6 months or less: HDB

&gt; SINGAPORE - Buyers of flats in 17 Build-To-Order (BTO) projects completed and delivered during the Covid-19 pandemic faced additional waiting time of six months or less, said the Housing Board on Tuesday (Oct 12).

&gt; The 17 projects make up about two-thirds of the 25 BTO projects delivered since January last year.

&gt; The remaining eight BTO projects were delayed by between seven and 10 months, said HDB.

&gt; In total, more than 16,000 new homes have been delivered to Singaporeans since January 2020.

&gt; Including pandemic-induced delays, the waiting time for the projects ranged from 2.4 years to 5.3 years, with an average waiting time of 4.1 years, said HDB.

&gt; Last Saturday, HDB said it is on track to complete another five more BTO projects by the end of this year, barring unforeseen circumstances.

&gt; This comes as National Development Minister Desmond Lee said in Parliament earlier this month that the average waiting time for ongoing BTO flats is between four and five years, even after taking into account delays brought about by the pandemic.

&gt; He was clarifying the misconception that waiting times for BTO flats have risen to six to seven years, given the impact that Covid-19 has had on the construction sector.

&gt; For newer BTO projects launched this year and last year, the estimated waiting times range between three and 5½ years.

&gt; While there are some projects that may take longer to complete, including Queen's Arc in Queenstown, which was launched in August, they are the outliers.

&gt; The 610-unit project in the mature estate of Queenstown has a waiting time of about 5½ years because of its difficult construction conditions and taller buildings.

&gt; One of the BTO projects completed and delivered to buyers during the pandemic was Bedok North Vale, which has 215 units across two blocks.

&gt; Construction began in May 2017 and the project was originally slated for completion in the third quarter of 2020.

&gt; All works were halted in April 2020 during the two-month-long circuit breaker.

&gt; The outstanding works then included painting of the common areas and landscaping works, as well as installation of fittings within the flats.

&gt; The project's main contractor, China Construction Realty Co, resumed works progressively after the circuit breaker measures were lifted in June and completed the project in December 2020, six months after its original estimated completion date. This brought total waiting time for Bedok North Vale to 3½ years.

&gt; As at Sept 30, 208 out of the 215 units at Bedok North Vale have been booked and more than 90 per cent of flat owners - or 194 - have collected their keys.

&gt; A number of key factors contributed to the quick resumption of construction works at Bedok North Vale following the lifting of circuit breaker measures, said HDB on Tuesday.

&gt; HDB worked with the contractor to build two temporary living quarters on-site to house workers, which helped reduce the risks of infection and the number of workers who needed to commute to the site daily.

&gt; Manpower was deployed to complete the works within the flats, such as painting of walls and installation of fittings, before moving on to works in the common spaces. This helped to speed up the completion of the flats by two months and buyers were able to get their keys earlier, said HDB.

&gt; HDB also gave advance payments to the contractor and co-shared the prolongation costs arising from the project delays, thus alleviating the contractor's non-manpower operating expenses.

&gt; The contractor also adhered to strict safe management measures on-site, which enabled it to resume works in just three days after one worker tested positive for Covid-19 during a routine swab test.

&gt; Virtual inspections were conducted, in additional to physical ones, and issues were rectified by the contractor before flats were handed over to their owners, said HDB.

&gt; On Tuesday, HDB said: ""All our building contractors have been affected by the pandemic, albeit to different degrees depending on their companies' resources and financial strength.""

&gt; HDB added that it has been checking in regularly with building contractors and consultants to address any problems early and render assistance where necessary.

&gt; It said: ""We have also been engaging some of the key sub-contractors and suppliers of our BTO projects to widen our sources of feedback and pick up emerging issues early.

&gt; ""We will monitor the situation closely, and stand ready to do more to help our contractors to complete their projects, so that flat buyers can collect their keys and move into their new homes with as little disruption as possible.""

---
1.0.2 | [Source code](https://github.com/fterh/sneakpeek) | [Contribute](https://github.com/fterh/sneakpeek)",2021-10-13 11:38:14 UTC
ae78914708bbb5a6dd4f383ee55519b5,This made my saturday. Thanks for the laugh 🤣,2021-09-17 16:30:55 UTC
5012c5a08809a680fbf32b0b36c4bb40,TLDR: please go buy 4D later.,2021-09-17 16:43:46 UTC
0162cb173c61e37695b35ccf05102ddc,"Read till the portion where you say he go be kindergarden teacher, thats where I know its all bullshit. Early childhood don't like male educators",2021-09-17 16:52:58 UTC
9aa84ba47039eff917539f0372f7522c,"The army general scored straight As during his A levels and had a good CCA record, and was pretty much set for a life of success. Ah boy really missed out a good opportunity.

/s",2021-09-17 17:37:54 UTC
11172c9176acd8b5968eb8f1e693d60b,Should have written this for o level compo,2021-09-17 17:14:40 UTC
879ea577a09d52b6edc38ad847506471,Very late Liao. You write long story is to encourage me to sleep sibo?,2021-09-17 16:17:32 UTC
08be5221107ccd14258c96764074bbef,[deleted],2021-09-17 17:22:03 UTC
2d0afb922c0e7acc571598a6f1b35f52,Ae you sure this is satire/parody? Sounds like pure Singaporean reality to me!,2021-09-18 04:02:40 UTC
e2ebe14cf7791884dcc87b4505a90800,The real Singapore Hard Truths.,2021-09-17 23:34:56 UTC
f462351d73e2e88633a5ba2307b26501,"Hi  


When he skip school and go arcade wat game he play?  


Thx and rgds",2021-09-17 21:24:40 UTC
5ac8ca44e02648942b460b59bd9ae932,"How did I know where this is going before I reached the end?  
  
The parachute CEO’s smile seemed fake, forced picture smile (his eyes were not smiling). I’m sure he’s a nice guy and all that, but ECDA is not SMRT you know, I’d be a little more happier if he had a genuine smile.  
  
Still better than Thailand Amy generals or Myanmar army generals I suppose, reach the top and think they know better than everyone else around them (years of listening to, “yes sir, you’re right sir” must be a little hard to face reality that you’re not always right).  
  
Anyway, my kids almost done with kindergarten, and I’m really impressed with ECDA - hope new general just relak and not cockup.",2021-09-17 23:01:56 UTC
86227850bfd75d4ce11ff8005016c374,"Was waiting for that ending

*Based On A True Story*

Had a good laugh. Well done OP",2021-09-18 05:36:50 UTC
04e5a9c92e84678ddcc5ca25b5c63ca0,I’m holding back tears… this is so powerful,2021-09-18 00:43:16 UTC
b3cac60060ee54b9d1f47846d1348166,Ah boy’s parents never tell him all ministries and gov agencies ceo positions are reserved for AOs…..should have just become ceo of tuition centre and maybe can earn even more..,2021-09-18 00:50:43 UTC
37874e5e79bd07b5e239517b9e2d8381,So terrifying it should be on /r/nosleep,2021-09-18 02:57:53 UTC
0c0752faf78496ffadd39dea6469bf3b,morale of the story is to sign on,2021-09-18 02:59:17 UTC
bf2977325d7a026f99c24a4d15e91151,The sad thing is that this story is actually being optimistic.,2021-09-18 06:12:39 UTC
fa5f0ed81a6a0f0c45ed9b7e43a9bacd,"If I ever have a son in this country and they ask me why they have to study so hard, I'd always tell them to do it because if they try hard enough in their first 18 years, they always have the backup option of becoming a garmen scholar. After that, they'd be able to sit on their ass for the next 60 years and get paid for it.

'Retired' by the 20s. That's the Singapore dream.

Anti pofma. This is my opinion. Not a fact. Of course there are good generals in civil positions too, but at this point I wonder if the bad apples are an exception.",2021-09-17 21:40:32 UTC
bf65b04bc09c57fdcab968f75502af80,You lost me at buying BTO with gf being a teacher,2021-09-18 05:35:53 UTC
9628f29b37d774698f8cfe385c3a5e4f,"At a time where most couldn't travel, thank you for bringing us to Holland sir.",2021-09-17 20:27:38 UTC
e47b8ede1246c0156fffa2d0bc5c94f5,"I totally thought this was just a fictional story...

Until i scroll down and see this: https://www.reddit.com/r/singapore/comments/ppzabg/saf\_general\_tan\_chee\_wee\_47\_chosen\_to\_lead\_early/",2021-09-18 00:04:10 UTC
4f3e0503962c1d435d716d3544078182,Much effort for sure,2021-09-17 17:05:05 UTC
ab77a1eac53d25ef1a39cfaec18b8cad,Ahaha I like this. Gave me a good start to me morning,2021-09-18 00:17:57 UTC
7c8e350786ab13c8cfa8c3865ef2fc37,"He no degree so sorry kennot.

The general have big big degree from Cambridge.",2021-09-18 01:17:02 UTC
90ac90a35bae04050f79c0ccb49165f0,Damn make me want to buy 4D. The story are really reflected the real world. Aiya.. Work hard also no use...,2021-09-17 23:10:05 UTC
bc628bb138211aaa9047ba4d561cbc62,"Great allegory.

It encapsulates the saying, ""It's who you know, not what you do,"" that is very real in Singapore Inc.

If you are familiar with the public sector in SG, floating in Administrative Service or Public Service Leadership folks (who are not domain experts or have deep experience in the domain) into apex and near apex positions across the public sector is generally par for the course. There are some but not many agencies whose apex leader starting as a fresh graduate or mid-career and rose to be the CEO of the agency.

My suggestion to young people starting their careers is to develop their emotional quotient, networking and socialising skills besides their domain or technical competency if they truly aspire to be a CEO/PS one day.",2021-09-17 23:37:04 UTC
49b4a9822b972af9e4584dc0b69542d7,Can you please do a TL;DR? It should be illegal for you to write a long story without a TL;DR,2021-09-17 15:59:01 UTC
c94cd2475d3a968d63904e300f567f39,👏👏👏👏 This is Brilliant.,2021-09-18 08:01:47 UTC
cf0de72eb63efe6bc15a69dcfb4833ef,base on a true story somewhere...,2021-09-18 08:51:03 UTC
44661a978c36e3c4a8a781abc915eb5c,Lmao the last paragraph got me laughing hard XD,2021-09-18 14:54:16 UTC
09dd3f1f129cf57a13309e06752208b1,Poke holes un the parachute!!,2021-09-17 23:42:28 UTC
23328d6a324b4fd86dcdfb7fce14eebf,EDMW's u/SamBellfromSarang 2nd acc and csb?,2021-09-17 18:17:08 UTC
a6d31826baf800b9cdaf25cd917de310,"At least ah boy got income, is no longer poor af",2021-09-17 19:06:17 UTC
c23833852556b564adacd445d6429cda,"haha... what a great story...

by the way how's your sex life?",2021-09-17 19:25:21 UTC
646c2de0ee5a06e91725d46e1d53704a,"Just because you don’t get to be the CEO doesn’t mean working hard was “no use”, if that’s the case then 99.9% of the organization have useless careers....",2021-09-18 03:32:42 UTC
8c17658d77cde48961ca8418c105219a,"""Stay a while and listen...""",2021-09-18 04:17:52 UTC
ce120f011ef0e0957586a5499ae2fbcb,"I know this is just a joke, but who knows if the SAF general has the same rags to riches story?",2021-09-18 05:50:49 UTC
5fc2c43332cc47af8701253ab8673538,Bigger in what way first? 🌝,2021-09-18 06:02:44 UTC
aac0c55d6744f7e61ea8a0c773f79508,Business friendly country.,2021-09-15 06:25:24 UTC
8806313b8e489bd8cdefbc1201ab3998,"&gt; # HDB throws lifeline to contractors to minimise delays to BTO buyers

&gt; SINGAPORE - Construction companies working on Housing Board projects have been thrown a lifeline to help lock in prices and supplies for some raw materials, in a move by the Government to ensure that construction progress remains on track and to minimise delays for home buyers.

&gt; Measures include extending the duration of steel price protection provided by HDB for a total of nine additional months so that contractors do not have to worry about the fluctuation in steel prices, said the Ministry of National Development (MND) in a written parliamentary reply on Monday (Sept 13).

&gt; HDB will also provide additional supplies of concrete materials to contractors for local pre-cast production, going beyond the amount that contractors had earlier opted for in their tender, said MND. This refers to cement, sand and other aggregates.

&gt; Previously, steel price protection provided for HDB was either for 18 or 22 months, typically covering the duration of structural works which are now taking longer to be completed due to the Covid-19 situation.

&gt; With the nine-month extension, a contractor who started structural works in January 2020 can now be protected against fluctuations in steel prices until March 2022.

&gt; The HDB said in a separate statement on Wednesday that about 35 projects could benefit from this extension.

&gt; Since January this year, the prices of steel and concreting materials have risen by about 25 per cent and 15 per cent respectively, it noted.

&gt; HDB has also received feedback from the Singapore Contractors Association that the quantities of steel ordered by contractors remain low due to the slower progress of construction works.

&gt; At the same time, in the light of Malaysia's movement control order (MCO), contractors here are relocating their precast production back to Singapore or switching to the cast-in-situ method of construction.

&gt; These contractors may have previously opted for a smaller quantity of concreting materials from HDB, given that their precasters were overseas, HDB noted. But they may now require more materials, which the HDB will provide them with and at the same price committed in the tender.

&gt; For contractors who wish to relocate some of their precast production back to Singapore, HDB will assist them in their application for land under a temporary occupation licence for the production and storage of the precast components.

&gt; Contractors will be able to apply for additional supplies from October 2021.

&gt; The move comes after the main contractors of five Build-To-Order (BTO) projects went bust last month, which caused around 2,900 buyers to face long delays for their homes.

&gt; The affected projects are Sky Vista @ Bukit Batok, Senja Heights and Senja Ridges in Bukit Panjang, Marsiling Grove in Woodlands and West Coast Parkview in Clementi.

&gt; The five projects are at various stages of completion, with the two Bukit Panjang projects near completion, said MND.

&gt; The main contractors, Greatearth Corporation and Greatearth Construction, along with three other related companies, are currently in the process of liquidation.

&gt; The construction industry has been one of the sectors worst hit by the Covid-19 pandemic.

&gt; Construction costs have risen, with increased foreign manpower cost due to tightened border measures and increased raw materials costs. Companies have also racked up additional costs to adhere to safe management measures that are meant to curb the transmission of Covid-19.

&gt; On Monday, MND said HDB is working with Greatearth and their provisional liquidator PricewaterhouseCoopers to bring onboard new contractors to take over and complete the five BTO projects as soon as possible.

&gt; Discussions are ongoing for the potential new main contractors and existing subcontractors to work together.

&gt; ""This will allow affected subcontractors the opportunity to work out a suitable arrangement to remain on the projects and complete the remaining works. It will also minimise the extent of delays for flat buyers,"" said MND.

&gt; 

&gt; One of the affected projects, West Coast Parkview in Clementi, under construction on Sept 3, 2021. ST PHOTO: MARK CHEONG

&gt; 

&gt; Just before mid-August, on the feedback from a project consultant, HDB had checked with Greatearth and was informed that they had run into financial difficulties and were exploring options to continue with the projects.

&gt; Slightly more than a week later, Greatearth informed HDB that they were unable to complete the five BTO projects, despite the government assistance provided to all construction firms over the past year.

&gt; Prior to this, work at the sites had been progressing satisfactorily, and there were no signs of work slow-down, said MND.

&gt; HDB had explored possible options to resolve Greatearth's challenges, such as providing advance payments to allow them to continue with the projects.

&gt; However, Greatearth did not have the financial ability to continue operations and made the decision to undergo liquidation, said MND.

&gt; Home buyers of the five affected BTO projects have not yet been informed of their revised completion date. HDB said buyers will be informed when the replacement contractors have been appointed and the construction schedule worked out.

&gt; In June last year, a $1.36 billion construction support package was announced to help construction companies co-fund some of the extra costs they have to incur to comply with safe management measures at the worksites.

&gt; Under the Covid-19 (Temporary Measures) Bill, construction companies can also get reprieve from legal and enforcement action for their building and supply contracts, although the relief period is set to end at the end of this month.

---
1.0.2 | [Source code](https://github.com/fterh/sneakpeek) | [Contribute](https://github.com/fterh/sneakpeek)",2021-09-15 06:10:54 UTC
9289222d0bdf2a92e9d64fc51f44d08b,"it's a cut-throat business in the first place. You think locking the raw material price is enough to cover the increase in sub-contractor cost and labor cost? When hdb award the project, they shld hv known if the quoted price is a sustainable one or not. Some of these contractors are already in a contractual loss to begin with.",2021-09-15 23:41:44 UTC
8e58f206922cf201f42efce70dfdef53,Can we tax more expat so we can have more welfare 😈,2021-09-15 09:29:10 UTC
b1a0a3d46389e489f4c4aa2003b63000,Kovan - Non mature estate.,2021-08-18 12:35:27 UTC
dec45c46c1ebce19b985a8b3b551e64b,How is Jurong East non mature... BTOs in Jurong East are so rare they just get eaten up quickly.,2021-08-18 12:47:51 UTC
0770526dbbc34659245cf442a0a23a07,[deleted],2021-08-18 14:35:56 UTC
e30400d15a8ad741d34b56614fc6e028,Tell me demand for Tengah outstrip Toa Payoh and I will be keen to know more..,2021-08-18 12:37:06 UTC
123d2afba1e24a0059ec6c1fdc1562f2,"Unfortunately, you're likely to have to wait 7 years for it to be ready. 7 years itch might creep in then 🤭",2021-08-18 17:41:50 UTC
8227533c64ab013194c1bf1ffdf83e9a,"&gt; # Demand for HDB flats in non-mature estates outstrips mature estates in August BTO exercise

&gt; The flat-type with the highest demand were four-room units in Hougang - more than 11,400 people applied for just 459 of such flats. That means each applicant only has a 4 per cent chance of getting a unit.

&gt; With more than 18 first-time applicants per four-room flat in Hougang, this is one of the highest application rates seen in recent years.

&gt; One of the main draws for applicants for Kovan Wellspring is its location next to the MRT station, said Mr Lee Sze Teck, senior director of research at Huttons Asia.

&gt; The development in Kovan is also “highly popular”, with few new BTO flats in the area, said Ms Christine Sun, senior vice president of research and analytics at OrangeTee &amp; Tie.

&gt; For Hougang Citrine, it is close to Paya Lebar Methodist Girls’ School and Maris Stella High - both “popular among parents”, she added.

&gt; There was also huge demand for four-room flats at Toh Guan Grove in Jurong East, with 3,628 applicants for just 240 units. This means each applicant only has a 6.6 per cent chance of success.

&gt; There is “pent-up” demand in the Jurong East area as there have not been many BTO launches there, said Mr Lee and Ms Sun.

&gt; This is the first BTO project in Jurong East in 10 years, and it is within walking distance to a station on the future Jurong Region Line.

&gt; Both Hougang Citrine and Toh Guan Grove also have an average construction period of about four years.

&gt; “The shorter construction period is the draw and the cash over valuation in the resale market is the push,” said Mr Lee.

&gt; In total, there were more than 18,600 applications for three-room or bigger BTO flats in non-mature estates, despite there being only 1,064 units available. This equates to more than 17 applicants per unit.

&gt; MATURE ESTATES

&gt; With 2,883 three-room or larger flats available in mature estates, this was the highest number of such units being made available in a BTO exercise since November last year.

&gt; Set to be built in the areas of Kallang Whampoa, Queenstown and Tampines, they drew nearly 15,000 applicants. That equates to about five applicants per unit.

---
1.0.2 | [Source code](https://github.com/fterh/sneakpeek) | [Contribute](https://github.com/fterh/sneakpeek)",2021-08-18 12:33:02 UTC
8bcdde2d77ad86f4097b31abc607b172,"OP has flaired the post with the ""Serious Discussion"" flair. We will be exercising greater moderation in the comments section against joke, irrelevant or off-topic comments. **These comments will be removed and offenders may face restrictions in accessing /r/singapore.** Please report such posts and comments. OPs must also engage in a bona fide discussion, i.e. the post should not be one just to incite outrage.

Note that the 'report' button is not an 'I disagree' button or a super-downvote, it will simply flag it for the mods' attention, and the comment will be evaluated for removal then.


*I am a bot, and this action was performed automatically. Please [contact the moderators of this subreddit](/message/compose/?to=/r/singapore) if you have any questions or concerns.*",2021-08-11 10:25:18 UTC
eb7c5c7f659280c0d8c6ed828c50f40b,"Honestly in my case, me and my wife took one look at the BTO offerings, then mathed out potential transport costs, ended up pulling the trigger on a 700k resale near my parents that was a 5 minute walk from the MRT. 

Lotta grants kicked in to knock the price down, but it was still a shitload more than a BTO in Sengkang/Punggol or Tengah. But honestly, it was worth it. Homeowners before we were thirty, space away from both our parents and an opportunity to really tailor our living space in a flat whose location we both love. I don't think we're ever gonna sell the flat.",2021-08-11 14:50:00 UTC
5319a9506fbb2cf58ae6d94947e57e17,"The bto second time I am guessing is to account for growth in family size. 
But yeah, they should really stop second timers from buying bto again unless there is a good reason. Probably time to change their policy. 

Although it's a tough chance to get near your parents like you mentioned... Who knows you might be the ""lucky"" few...some on reddit seemed to have shared that they got it on first try. 🤷‍♀️",2021-08-11 10:47:25 UTC
a9b9efe3f84d28cb1e1526730fcd27be,"I am a second timer who will be applying this time round. I am recently divorced with a 2-yo daughter. Even with the sale of the matrimonial home and I downgrade to a 2-3-room flat, I still have to take a HDB loan. My family home has no space to accommodate us. Not everyone is here to make money from getting and selling HDB flat. You have your specific reasons to get a BTO, some of us just want a shelter. And only a very small percentage of units are actually reserved for us.",2021-08-11 15:39:03 UTC
bef314544d4df7cc053ce80bdcbeb1f7,"Lmao just owning a home in SG as a millennial is a source of frustration, full stop. Doesn't matter if you're single or couple, buying house in SG is just a nightmare.

Single? Wait till 35 and try to BTO and pray you get your house before you turn 40 or you better hope your account is fat enough to go to private.

Couples? BTO still a shitshow with no guarantee (even if you honestly don't intend to flip) or you better hope your account is fat enough to go to private. At least you got a partner to help for the latter.

I myself am still single in my early 30s and long to own a house of my own too. 
 But all permutations that I've seen are way over my budget that it just doesn't make sense. And I don't believe in renting either. So LLST and just keep looking at 99.co and daydream.",2021-08-11 11:31:15 UTC
a2d7d2d5761c37d1f9d636b8feacb28f,"I commented on something similar before. I think your diagnosis of the problem is incorrect. You shouldn't be asking why second timers can BTO but why resale flats are so expensive when the sellers got it from HDB for cheap. Otherwise, you could just buy a resale meeting your needs unless you're in it for the BTO gains too. Not that resale can't be more expensive (they should because they are ready for move in) but the current price gap is ridiculous.

Then again, many couples prefer the current system where they can make big bucks winning the BTO lottery..... until they don't and have to buy resale.",2021-08-11 10:46:18 UTC
50b820cdc9f9308a6c6ca1bb4b7dcb09,"I was in your shoes many years ago. Rented a room with my S/O for 3-4 years before my BTO was ready. Also, applied 3 times before i got a decent queue number. If you can, live with your parents while waiting for a flat. If you want your own space, plenty of properties for you to rent from while waiting.",2021-08-11 10:35:09 UTC
d41fa06242f0ad261e0fb04fb5e2e389,"I empathise, same boat. Sorry but yet another HDB rant.. get in line.

Whatever that needs to be said has already been said. You see this discussion on this sub every month.",2021-08-11 10:27:55 UTC
