comment_id,comment_text,date
9ca05616de1bcc85b3dcca8c36543373,"Hi guys, Que number is 48X/238 for Semb Sails, 4 room
Under others category. I asked my friend and he mentioned that I likely have a chance to get a flat since I'm under others. I remember that 85% of the flats are reserved for first timers, which I also am. What are my possible chances? I'm not under any priority scheme so 🤷🏽‍♂️",2020-12-15 16:33:48 UTC
dd03292eb36785e3683ef3f545c31166,What should you do if they only just told you you're invited?  Is it just bad units left?,2021-06-09 14:17:30 UTC
b07d9babbbb74866b9eff7e953ec1c1c,"I thought they had this at Golden Pines, Tampines?",2020-12-10 14:58:55 UTC
8724997cb2d7a5f964e0ae27df1a8066,Further reinforcing that the West/North is full of old people and is stale af,2020-12-10 15:28:17 UTC
d96f9e746b812e217caac2a0de14d28d,Thought this is the ‘upgraded’ version of Kampung Admiralty.,2020-12-11 20:16:15 UTC
9914f72f3984d621431fe71ad602496e,About the same size as a recent bto,2020-12-05 00:39:19 UTC
55d0d266c43e4c9450477b6837778a43,"Hi @u/yiantay-sg, may I know where you purchased these? I am doing research on HDB and this is interesting material.",2020-12-05 01:01:47 UTC
5159ea53345159020462d18792d15e76,Wow! I feel like I'm being mocked but I just laugh?,2020-12-05 03:43:58 UTC
e85e0f347e6ba122efd580dd873f93af,"Thank you so much for sharing this! I got so excited and looked at the link you posted, then immediately texted my sisters and asked them to buy me 2 sheets of the whole set. I miss home so much and collect uniquely Singaporean things to display in my house, this is definitely it for me.",2020-12-05 04:47:07 UTC
c0da377e58eb11cb335e73af11d9a38b,Propose with a BTO 😂,2020-12-05 04:14:04 UTC
53ce05ad1071de6b9e76787260165909,is this supposed to be a point of national pride for us?,2020-12-05 11:29:18 UTC
418948dcc96b0803af9fac59642ce5dc,I dont know why but am I getting pissed off at these stamps.,2020-12-05 02:16:29 UTC
a9b17354c63fa8a2c01ee92cf5110da0,"Maybe someone could help interpret?

- the building coming out the ring - connecting BTO to marriage?

- why the lock at the bottom?

- why the key with the hearts floating in the air?

- why is this a “quirk”?",2020-12-05 05:30:33 UTC
fca9dedf66c858fc45dc4a47dfcb395d,*Uniquely Sillypore*,2020-12-05 13:05:24 UTC
099e6ad49088f998adab748e3fe19e26,Funny how they have the cheek to make this into a stamp when BTO is the very reason for the screw up in our housing system.,2020-12-06 16:25:36 UTC
97a44693fc1d5ce115ed22e71e220d72,the best fix is to just increase the bto supply in the first place. even non mature plots are much oversubscribed nowadays,2020-11-29 09:06:58 UTC
2fbc5bf95a67c0bf5767a00ea66b4034,Limit resale to selling back to hdb. Then resale has to go through hdb Hdb then be transparent and sale profit can then be used for further grants for the needy.,2020-11-29 08:48:36 UTC
c3d4e6a9102eec7bf7cbfe215c260e48,Er. Wouldn't longer MOP means even higher resale price for matured estates? High resale price is a function of people having money plus the prices of private and HDB units in that area right? More time just let more value be built.,2020-11-29 09:03:02 UTC
9a0f13824db1bcea68e20324ad3eeb6e,"Current supply cannot meet the demand, that is why resale have been going up. Because not everyone is lucky enough to ballot the place they want + have the patience to wait up to 7 years for their bto to arrive and another one year for reno.

Honest good solution would be to scrape the whole bto idea. Actually give people who want to start a family the chance to buy subsidised housing to get married, move in, and have kids.

The current problem we have right now is that the resale flats are being bought by couples who have no other choice than to buy at those prices. A bto 5 rm costs example 500k. A resale flat that has been occupied for 20 years with the same size would cost similar or slightly more. The couples have no choice but to pay for asking if they want to live in the district but can't ballot for the bto.",2020-11-29 15:55:06 UTC
9354c2f7298780ade0a0d2aba77a923e,"They should just trust their central planning. It's gotten better with more analystics and a burgeoning ""middle class"". 

Just build, sell during launch and price it higher towards TOP. The details can tweak. They just need to be daring and trust the ""data analytics"" way of doing things.",2020-11-29 11:33:25 UTC
dfc5e7475a82f3b455baf884d537a949,Thank you for your service,2020-11-20 15:49:05 UTC
0430eeaee3080fb14cef7fef487111e4,BTO is real life gacha,2020-11-21 12:19:05 UTC
50848de6ff3c0cad870915b8cfb407bd,"My SBF at bendemeer i gotten years ago was an absolute steal. Queue # 3, got to choose a High floor unit, bright, unblocked view, windy, can see malaysia and indonesia (no joke!) And its market price is almost double of what i paid for. Song song go jurong..",2020-11-21 01:57:25 UTC
a3ba02ace053c208a5f57d66610e0ec6,"Just a question, I got a number from August BTO but the chance is near to 0%, Can I apply for this November one. Sembawang 2-rm flexi.",2020-11-21 04:35:33 UTC
a51a02c4ef5acd45eae53aa3185093cd,I'm one of those who are trying for the 5rm at Bartley. Mad.,2020-11-21 01:49:01 UTC
9cda1cc9df377a8b761b0ca39defefea,"this is home, truly",2020-11-21 00:38:01 UTC
58083c73c4599ce829d14365e1ea2d1b,"Note that it's not necessarily cheaper to Reno resale.

I find it a idiot move similar to all the different forms of marketing where it's a trend to full Reno your house.

I understand that you should reno the house base on how you wan to live in it. I did that for a 4 room resale under 25 K including buying of all the stuff.

Yes it is only a small reno and that is not it should be.

All those glam reno is the same as having a huge ass wedding. Worthless unless you really want it.",2020-11-21 02:36:17 UTC
3b28e41b755b3d6e2597218b02a9f89c,"One thing everyone tend not to realise about SBF is the missing of the golden opportunity window for SBF as compared to BTO. 

Every house has a TOP date. So essentially, if you buy a house that has keys available or soon but others in the area have already taken their keys, you are surely going to miss out on the boom in prices once the unit MOP, depending on how long you are lacking behind. When you are finally able to sell, the market will already be saturated with units from the same area and the price would start trending downwards. This along with the fact that SBF houses are leftover due to odd shapes/ angles, direction and floor level, will push the price down even more. 

Another thing is the number of flats available and the application rate. 

For example, TPY SBF has a application rate way higher than the BTO for now. For both 4 room and 3 room. You stand a way higher chance of getting your flat in your desired location from BTO compared to SBF. For example, the 3 room application rate is almost a sure get as of now for the BTO as compared to SBF (0.4 &amp;0.9 respectively. Subjected to changes in application in the coming days). 

If you opt for a BTO instead of SBF and choose to rent for the time being, you can actually save some money and stand a chance in getting a flat that has nice qualities that you prefer, instead of getting the leftovers.

The COVID-19 delay is probably negligible if everything goes back to track now (no second wave etc). HDB is just extending the ECD date to cover their own arse. 

SBF is traditionally and should still only be considered if you are really not the picky kind and die die want a new house as fast as possible. 

Last point to note is that even if you get your house now, renovation cost a bomb currently as they are severely lacking in manpower due to travel restrictions. 

So do factor in all these considerations and decide what are your priorities before you follow the hearsay.",2020-11-20 18:16:14 UTC
1125f99a09ab2ea5a646813f0159cf4d,"I just have a resale flat and the mop is five years away, am I still able to apply for this bto?",2020-11-21 02:59:17 UTC
577240ba9dbeb840f88093d31ea9a029,You can view the SBF flats available down to block and unit number when the website gets back up,2020-11-17 16:59:49 UTC
fc9585fdb1000b0814616ed17054bead,The oversubscribed ratio for SBF generally is way worse than BTO. 20 flats left can have 500 applicants etc.,2020-11-17 22:41:20 UTC
4d2061bfa1d9b43b62751c8a213ca406,I came to this thread expecting a different SBF.,2020-11-18 02:13:10 UTC
37e2016a21333a8c8f5ff70d5fdd4625,"Take it from someone who is staying in a SBF flat currently.

\- They group all the ""leftover"" flats together in one area. Eg mine was TPY and they lump all the units in TPY, Bidadari and JS (the latter two aren't even in TPY to be frank) together for selection. I was hoping to be able to pick a unit in TPY but it's tough because my q number was near the end of the allocation but still within it. The first 10+ in the q all went for TPY units of course.

\- So let's say you want to pick a unit where the flooring and doors have been selected, you have to pay for the previous dude ""mistake"". All these are added into the unit cost. But its ok cos I didn't wanted to wait 3 years plus for the Bidadari BTO to be completed and it cost more in fact.

\- Balloted under MCPS as I wanted to continue to stay near to my parents and I loved TPY a lot as I grew up there, just to note your parents cannot sell their flat for the next 5 years also if you pick a unit under this scheme

\- Also to note if you have the intentions to just stay until MOP and sell, you will be at a slight disadvantage as your MOP will be later than your neighbours and the rest who had got their keys earlier. When I got my key, my neighbour has already stayed for 2 years and reaching MOP soon and got bombarded with lots of property agents flyers and visits but I can only tell them not keen as I have not fulfilled 5 years MOP.",2020-11-18 08:48:38 UTC
c5de9ab5b2e8f946f11c91937a1ad21f,"Hello! Another fellow SBF applicant here :) Agreed there’s a lack of details and specifics this round.

We’ve decided to try our luck with a 5 rm flat located in “Central” and they weren’t more specific than that - could be anywhere in Tiong Bahru, Tanjong Pagar or even Bugis, and no information on whether it’s a BTO or an older, repurchased flat. What I found fairly useful/informative was  the SBF Nov 2020 application rate (Google that; it gives you a breakdown of how hot in demand the various SBF flats available are). The data is updated at least once every 24 hours. 

(The odds aren’t looking good for the “central” flat we’re eyeing. 10 applicants so far to the single available unit! Good luck to you too.)",2020-11-18 09:26:15 UTC
44375d322c9e797ee9d0f40322475912,"Decided to try out SBF in Tamp as well. You can check the application status thats updated every day at 8am, 11am, 2pm and 5pm. https://www.hdb.gov.sg/cs/infoweb/residential/buying-a-flat/new/buying-process/manage-my-application/application-status",2020-11-19 00:36:42 UTC
c0d134693f008ce4d19e13d829619b4e,"Its much more complicated for sbf. Are there any other projects besides the ones u want? If there are units still avail but not what u want, u will incur a penalty if u did not take it up.u cant really get to be choosy.",2020-11-18 05:55:40 UTC
8925ef84411a39b1c0416bae17f2d0a6,"So anybody has a clue which neighbourhood(s) have lesser people applying vs supply of flat ie lowest competition? Judging from the Nov 2020 SBF Exercise, is there any speculation one can draw based on the new developments in the area vs neighbourhood popularity?",2020-11-29 03:01:51 UTC
91d43e8c3ab0883d9105d074fd49cf43,"Hi everyone. Just wanted to check if anybody has received any result of the application yet? If I remember correctly, the results are supposed to be out in December.",2020-12-22 02:40:21 UTC
41b5048f1b7d5f7e3cdba7a713ca710e,SBF results are out!,2020-12-29 10:58:59 UTC
eeb12cfb088db8abf4415e9c2ecc3ee6,"This might be controversial but I don't believe there's any point in buying new condos. Older ones are significantly cheaper (with the price difference you can splurge on some renovation AND still have money left over), are usually more spacious (especially those from the 80s/90s), and you have higher chance of hitting enbloc lottery (whereas a new one is likely not gonna enbloc until at least 25-30 years, if not a lot more)",2020-11-16 06:42:46 UTC
bef0b2662c0c0b8aec40b7669989f9d0,"I'm ineligible for HDB (foreigner), so buying a private condo was my only option -- well, either that or rent forever. I was 34 at the time. No regrets so far. The condo is a five minute walk from my work place, and that adds a lot to quality of life.

One thing I did right was shopping around on loans 'til finding a really terrific rate. It's even better now after a recent refinancing. Current macroeconomic conditions favor people in debt; this is a *great* time to be leveraged at low rates. One thing I wish I'd done more is push a bit harder in negotiation. I found it awkward at the time, and probably paid $20-30k more than I had to because of my reticence to play hardball.",2020-11-16 05:45:24 UTC
5f668ce994ab7f6757ad3dd96c7021ae,"Step 1. Count your money.
You need around 28%~29% of the property value in Cash and CPF OA for deposit / downpayment/ stamp duty etc, Go ahead and flush your CPF empty because when you buy a property, OA and cash are essentially the same thing. Liquidate your stocks accordingly, I keep bank stocks to hedge against but thats just personal preference

Step 2. Count your money again for monthly mortgage.
Remember that your mortgage can be offset by CPF monthly contributions as well. Find out how much you are comfortable paying every month, including the maintenance fee (which is around 300ish a month as well as property tax another 100~200ish). You can then get a loan approval on what is the maximum loan from the bank. That number will be much higher than you expect because mortgage brokers are greedy bastards. Use the number that you are comfortable with.

Step 2a. The loan you want should be the SIBOR based one, interests rate are low now because the economy is shit so that is a good option. Meanwhile, get a cheque book if you haven't already

Step 3. Now you have the price range that you know what is within reach. I don't think you will exceed 1.2 million unless you are really loaded with 10k monthly salary or will be willing to eat white bread only for next 10-20 years

Step 4. Go to propertyguru and filter off by that limit and whether you want resale or freehold or new launch. Start messaging the property agents to visit the places while waiting for loan approval. The listed price on propertyguru can usually be negotiated within 10~15%, but it all depends on luck and whether there are other people bidding for it.

Use https://www.ura.gov.sg/realEstateIIWeb/transaction/search.action
to find out previous transactions

A lot of agents will push you to visit their new launch and convince you that as a first time buyer, your low stamp duty is really profitable. Just remember that the new launches give them a much higher commission cut.


Step 5. You will never be truly happy with a property purchase. You will feel slight injustice at the flaws the agent hid from you, or whether you could have negotiated a better price. Don't sweat it too much and as long as it ticks your major checklist its good enough.

All the best!",2020-11-16 05:44:24 UTC
5982976be6d76611f37fbf06ef5594e3,[deleted],2020-11-16 05:24:56 UTC
8394d9d3195a3c6e1b59dc59ef2e4737,"if you've never lived alone before, spend a year or two renting so you can determine what matters to you in a home?",2020-11-16 05:55:41 UTC
733da5a437f258fdaf7935efd51ce158,"On a very personal basis. I am now a healthier person because the gym and pool are both 1-2 minute's walk from my ground-floor unit. Regular exercise was something I've miserably failed to do in the past until it became so exceedingly convenient for me, so I felt my condo purchase / maintenance instalment had priceless benefits for my health.

Monetarily, you can try to map out your regular cash flow, as well as your income / expenditure / savings / investment planning. I somewhat stretched my numbers a bit because I do not drive, my parents don't need my $$$, I do not have children, and my fiance has his own money and properties. Because I was too disinterested in actively investing in the financial markets, I was quite happy in parking more $$ than usual in this property compared to general advice/standards.",2020-11-16 06:10:56 UTC
4edaed5db78a8c26dc3080961e613fd2,"I bought a 2BR condo from developer when I was 28, but I borrowed money from my parents to take a smaller loan. Rented it out for 2 years upon key collection as I wasn’t comfortable with the mortgage-salary proportion. Moved in after lease ended and have been staying at my unit for 2 years. My consideration during purchase was that it would be a form of forced-savings/investment, but a place that I would eventually move into, so it had to be near a train station, preferably new (no need to reno), and a relatively larger development (typically lower monthly maintenance). 99-year lease is fine, as I wasn’t looking for en-bloc potential. Had a friend follow suit but he bought a smaller condo unit and did 80% loan.

In hindsight, I wouldn’t have rented out because tenant was a nightmare with payments (although the rent did defray my costs as I worked to increase my income). I would also have chosen a location much closer to my parents. Personally, housing loan is still a psychological liability because it’s a huge quantum on a single income. But other than an initial 50k from CPF, I’ve never touched CPF since, so my CPF acts as a buffer if I ever lose my job. Also, I’ve turned 35, and am thinking of downgrading to a resale flat. Condo-living is quite overrated in my opinion.",2020-11-16 12:17:39 UTC
555fac54777eac8ee093deb2948c0dc6,"When I bought my condo (3BR, city fringe, boutique), I did not treat it as an investment. It was to be a home, so I looked for features that I like: small estate (fewer residents), near MRT, good layout, good location. I was less fussed about likelihood of capital gains or rental yields, as long as the price/mortgage is acceptable and I know I can afford the monthly repayments. I was very cautious about the financial part, and made sure to calculate not just the monthly outlay but also whether I can afford to repay if I am without a job for a period of time. Took up a flexible 3-mth SIBOR mortgage as I expected interest rates to fall, but refinancing is always an option anyway.",2020-11-16 07:15:51 UTC
7dff8b481a7d6072f94faeb50d3ef316,"If 32 just rent for a few years then get a resale. 

no point imo stretching your finances for a condo. Why —&gt; going to assume u have a comfortable lifestyle now. Why burden yourself with a large debt during this time?",2020-11-16 06:04:21 UTC
f0a5ca6833e7eba08006d321c0053291,"It depends on what is your motivation for buying a property, and what is your plan for next 10 years. For both properties, it is a 6 digit sum, for most people, they know what they want - e.g, live alone, money motivated, want to be debt free asap, space, amenities, etc.

For private, you can sell anytime you want (first 3 years you will suffer seller stamp duty of 4-12%), its a smaller place, easier to live as a single, but when you have family it will be very troublesome.

For HDB, after you buy, there will be a 5 year MOP waitout before you can sell.",2020-11-16 06:57:32 UTC
cebb4de239f84a7564356c91b7b1623a,Get 2BR so you can rent out 1 room to help to tank some of the monthly mortgage.,2020-11-16 08:07:33 UTC
da29cf291d1c48c93e8444ed0e5550b6,"Just make sure you can afford it. Buy something you can comfortably afford so that the other expenses associated with the  lifestyle will not get in the way

If you can manage it, do it. there's nothing else to worry about. the feeling of being able to afford and live in your own private condo in your early thirties and the lifestyle that affords you is nothing short of amazing",2020-11-16 10:56:13 UTC
156d21d6dabe02dc5f31dd499038ea1a,"As a single that got a condo when I'm below 35, it will do well if u can at least give an estimation of your net worth before you 'think' you want to get a condo.


How much cash plus cpf plus liabilities you have currently? Do you got any idea where u want to live and pricing of that location? Have you did any bank loan assessment before and tried an approval in principle from the bank? Have you calculate your total debt servicing ratio? 

No point of gathering feedback from anyone if you haven't done these due diligence yourself.",2020-11-16 13:43:26 UTC
1775c5294869c968f8a877ad3cfb65e9,"I\`m looking at condo now too. Maybe it\`s societal branding, I feel condo is an upgrade from HDB. Finances aside, I\`m comparing both HDB and Condo qualities.

\-Double/Triple the price compare to resale-All the ""good"" spots are taken by HDB - Condo either Ulu or near expressway-Met people from condo who are stuck up - abit like people who go for entry level conti, pushing it n seems v proud of it (concern about living near these people)

Good thing is there is no 5 year MOP, can buy before 35. Ok i mean the environment is nice but am I staying inside or outside most of the time ?

Anyway for the finances part, sometimes I stop and think, 700sqt condo v hdb, for the price difference, what am I really getting ah ?",2020-11-16 11:41:39 UTC
5716a0818a189f47c0df08cc148c1463,"I think the important point here is liquidity. You are single and buying condo compared to couples who buy HDB. They have 2 incomes paying for a much cheaper property. I assume condo cost double HDB for the same rooms at least.

Take a look at your industry/career and how it will go.",2020-11-16 07:34:29 UTC
d21173586a87718e9328e2d670b8678a,"I just got a resale one bedroom mixed development unit and will be getting my keys in jan 2021. I started looking since early this year. Do your finances, and view as many units as possible.",2020-11-16 13:06:47 UTC
03cc165f33ba6b4f98724fe7471e0ea8,"Are u able to afford the loan repayments? The down payment is rather high, unless u r a super high earner, otherwise it may not be a wise decision.",2020-11-17 06:05:01 UTC
68306b18d3d462e9597ef7932d53b215,"My husband got a 2BR condo at $800k at your age in early 2017, and as you said, it *is* a massive financial decision. He took a bank loan and wiped out most of his savings for the downpayment. He bought it because at that point he really didn't think he would ever settle down at all. End 2017 we met and fell in love and etc., and made the decision to get married in 2018 (gotta say that I did not fall for him because he had a condo though, I would much prefer to settle down in a HDB). Fortunately for him, he worked in sales and was able to save for our wedding (and more) within the next year. He also doesn't fork out any cash to pay for the condo's mortgage because it's all through CPF for now, so that's really a huge relief. The condo unit value has now surpassed $1m but we're still undecided on whether to move into it (currently pending TOP) or to rent it out.

I reckon it's possible for you if you're prepared to commit to the huge downpayment at the start? However, learning from my husband's story, I also would not discount unexpected life decisions e.g. meeting someone you actually want to spend the rest of your life with and perhaps other occasions that may cost you quite a bit. Your emergency fund shouldn't be compromised when committing to this big-ticket item. I hope that helps somehow!",2020-11-18 02:54:20 UTC
2d6c96494f00b1da706c8d0ae3290a6c,[deleted],2020-10-14 07:08:21 UTC
defbbf2b67f5ba0f7a6e4dd897915658,Saved for when i find a wife or when im 35,2020-10-14 07:50:28 UTC
7593d1d985e691141f91024d6415a9c6,"&gt; First timer singles applying for BTO flats need to pay $15K in addition to the flat price

smlj why??!",2020-10-14 11:53:06 UTC
1ca98ed896b9c4f616eb2215f8aeb8e1,[deleted],2020-10-14 06:56:46 UTC
86ac45ec5bfefbca725f3940b30ac601,You don’t like borrowing so you paying upfront? Wow👏,2020-10-14 08:30:49 UTC
501a3da7c85bf5a5abfecc398c4abdfc,"Doing God's work.

Something HDB should have made perfectly clear",2020-10-14 08:21:49 UTC
e29d4f2200c82aac89d46de6f861ef10,[deleted],2020-10-14 07:35:46 UTC
